21, Tana_double,      Worcester,    DFO, Executive Advisor,             902-426-3246, Tana.Worcester@dfo-mpo.gc.ca,    Expertise A, 1, None, 1, 1, 1, 1, 1, 1, 1
22, Laura_double,     Ferris,       DFO, Quality Assurance Officer,     613-990-0293, Laura.Ferris@dfo-mpo.gc.ca,      Expertise B, 1, None, 1, 1, 1, 1, 1, 1, 1
23, Tobias_double,    Spears,       DFO, Head of ODIS,                  902-456-8546, Tobias.Spears@dfo-mpo.gc.ca,     Expertise C, 1, None, 1, 1, 1, 1, 1, 1, 1
24, Christina_double, Maclean,      DFO, Administrative Assistant,      902-426-7070, Christina.Maclean@dfo-mpo.gc.ca, Expertise D, 1, None, 1, 1, 1, 1, 1, 1, 1
25, Lottie_double E,  Bennett,      DFO, Environmental Science Advisor, 902-402-3440, Lottie.E.Bennett@dfo-mpo.gc.ca,  Expertise E, 1, None, 1, 1, 1, 1, 1, 1, 1
26, Rabindra_double,  Singh,        DFO, Aquatic Science Biologist III, 506-529-5881, Rabindra.Singh@dfo-mpo.gc.ca,    Expertise F, 1, None, 1, 1, 1, 1, 1, 1, 1
27, Tara_double M,    McIntyre,     DFO, Aquatic Science Biologist,     902-402-8589, Tara.M.McIntyre@dfo-mpo.gc.ca,   Expertise G, 1, None, 1, 1, 1, 1, 1, 1, 1
28, Una_double,       Goggin,       DFO, Science Advisor,               902-426-9920, Una.Goggin@dfo-mpo.gc.ca,        Expertise H, 1, None, 1, 1, 1, 1, 1, 1, 1
29, Jay_double,       Bugden,       DFO, Aquatic Science Biologist,     902-426-7256, Jay.Bugden@dfo-mpo.gc.ca,        Expertise I, 1, None, 1, 1, 1, 1, 1, 1, 1
